[
  {
    "id": "mb-winnipeg",
    "name": "Winnipeg, City of",
    "province": "MB",
    "tier": "single",
    "upper_tier": null,
    "population_2021": 749607,
    "statcan_csd": "4611040",
    "website": "https://www.winnipeg.ca/",
    "source": "https://www150.statcan.gc.ca/t1/tbl1/en/tv.action?pid=9810000201"
  },
  {
    "id": "mb-niverville",
    "name": "Niverville, Town of",
    "province": "MB",
    "tier": "single",
    "upper_tier": null,
    "population_2021": 5947,
    "statcan_csd": "4602046",
    "website": "https://www.whereyoubelong.ca/",
    "source": "https://www150.statcan.gc.ca/t1/tbl1/en/tv.action?pid=9810000201"
  }
]
